Campfire,650,440,none,none,Music is a universal language. I hope it can help guide us.,Radio
Radio,770,130,beat,none,This place is so creepy. Don't you feel cold?,Jacket
Jacket,30,280,none,none,Maybe we can chat with someone and get some clues.,Phone
Phone,260,550,none,none,That person was attacked by something unknown. He did not have time to get his belongings and ran away.,Journal
Journal,100,80,puzzle,none,The person left behind a journal from his time in this forest. It mentioned something sharp.,Knife
Knife,820,570,none,none,Does the knife belongs to the person who was attacked or someone else that we do not know about? Is he/she the one who set up the camp fire?,Flower
Flower,380,480,none,none,The person died. But who set up the grave and put flowers there?,
